{
  "schema_version": "spell_lists_compiled.v1",
  "build": "P4.10.4",
  "generated_from": "data/spell_lists_canonical_v1.json",
  "classes": {
    "Druid": {
      "1": [
        {
          "spell_id": "detect_magic_lcleric_magic_user_druid_1st_level",
          "name": "Detect Magic"
        },
        {
          "spell_id": "detect_snares_and_pits_ldruid_1st_level",
          "name": "Detect Snares and Pits"
        },
        {
          "spell_id": "faerie_fire_ldruid_1st_level",
          "name": "Faerie Fire"
        },
        {
          "spell_id": "locate_animal_ldruid_1st_level",
          "name": "Locate Animal"
        },
        {
          "spell_id": "predict_weather_ldruid_1st_level",
          "name": "Predict Weather"
        },
        {
          "spell_id": "purify_water_lcleric_1st_level",
          "name": "Purify Water"
        }
      ],
      "2": [
        {
          "spell_id": "create_water_lcleric_4th_level_druid_2nd_level",
          "name": "Create Water"
        },
        {
          "spell_id": "cure_light_wounds_lcleric_1st_level_druid_2nd_level",
          "name": "Cure light Wounds"
        },
        {
          "spell_id": "heat_metal_ldruid_2nd_level",
          "name": "Heat Metal"
        },
        {
          "spell_id": "locate_plants_ldruid_2nd_level",
          "name": "Locate Plants"
        },
        {
          "spell_id": "obscuring_mist_ldruid_2nd_level",
          "name": "Obscuring Mist"
        },
        {
          "spell_id": "produce_flame_ldruid_2nd_level",
          "name": "Produce Flame"
        },
        {
          "spell_id": "speak_with_animals_lcleric_2nd_level",
          "name": "Speak with Animals"
        },
        {
          "spell_id": "warp_wood_ldruid_2nd_level",
          "name": "Warp Wood"
        }
      ],
      "3": [
        {
          "spell_id": "call_lightning_ldruid_3rd_level",
          "name": "Call lightning"
        },
        {
          "spell_id": "cure_disease_lcleric_3rd_level_druid_3rd_level",
          "name": "Cure Disease"
        },
        {
          "spell_id": "hold_animal_ldruid_3rd_level",
          "name": "Hold Animal"
        },
        {
          "spell_id": "neutralize_poison_lcleric_4th_level_druid_3rd_level",
          "name": "Neutralize Poison"
        },
        {
          "spell_id": "plant_growth_ldruid_3rd_level_magic_user_4th_level",
          "name": "Plant growth"
        },
        {
          "spell_id": "protection_from_fire_ldruid_3rd_level",
          "name": "Protection from Fire"
        },
        {
          "spell_id": "pyrotechnics_ldruid_3rd_level_magic_user_2nd_level",
          "name": "Pyrotechnics"
        },
        {
          "spell_id": "water_breathing_ldruid_3rd_level_magic_user_3rd_level",
          "name": "Water Breathing"
        }
      ],
      "4": [
        {
          "spell_id": "animal_summoning_i_ldruid_4th_level",
          "name": "Animal Summoning i"
        },
        {
          "spell_id": "control_temperature_10_foot_radius_ldruid_4th_level",
          "name": "Control temperature, 10-foot radius"
        },
        {
          "spell_id": "cure_serious_wounds_lcleric_4th_level_druid_4th_level",
          "name": "Cure Serious Wounds"
        },
        {
          "spell_id": "dispel_magic_ldruid_4th_level_magic_user_3rd_level",
          "name": "Dispel Magic"
        },
        {
          "spell_id": "hallucinatory_forest_ldruid_4th_level",
          "name": "Hallucinatory Forest"
        },
        {
          "spell_id": "insect_plague_lcleric_5th_level_druid_4th_level",
          "name": "Insect Plague"
        },
        {
          "spell_id": "plant_doorway_ldruid_4th_level",
          "name": "Plant Doorway"
        },
        {
          "spell_id": "produce_fire_ldruid_4th_level",
          "name": "Produce Fire"
        },
        {
          "spell_id": "protection_from_lightning_ldruid_4th_level",
          "name": "Protection from lightning"
        },
        {
          "spell_id": "speak_with_plants_lcleric_4th_level_druid_4th_level",
          "name": "Speak with Plants"
        }
      ],
      "5": [
        {
          "spell_id": "animal_growth_ldruid_5th_level_magic_user_5th_level",
          "name": "Animal growth"
        },
        {
          "spell_id": "animal_summoning_ii_ldruid_5th_level",
          "name": "Animal Summoning ii"
        },
        {
          "spell_id": "anti_plant_ward_ldruid_5th_level",
          "name": "Anti-Plant Ward"
        },
        {
          "spell_id": "commune_with_nature_ldruid_5th_level",
          "name": "Commune with nature"
        },
        {
          "spell_id": "control_winds_ldruid_5th_level",
          "name": "Control Winds"
        },
        {
          "spell_id": "hold_plant_ldruid_5th_level",
          "name": "Hold Plant"
        },
        {
          "spell_id": "transmute_rock_to_mud_ldruid_5th_level_magic_user_5th_level",
          "name": "Transmute Rock To Mud"
        },
        {
          "spell_id": "passplant_lmagic_user_6th_level",
          "name": "Passplant"
        },
        {
          "spell_id": "sticks_to_snakes_lcleric_4th_level_druid_5th_level",
          "name": "Sticks to Snakes"
        },
        {
          "spell_id": "wall_of_fire_ldruid_5th_level_magic_user_4th_level",
          "name": "Wall of Fire"
        }
      ]
    },
    "Magic-User": {
      "1": [
        {
          "spell_id": "charm_person_lmagic_user_1st_level",
          "name": "Charm Person"
        },
        {
          "spell_id": "detect_magic_lcleric_magic_user_druid_1st_level",
          "name": "Detect Magic"
        },
        {
          "spell_id": "hold_portal_lmagic_user_1st_level",
          "name": "Hold Portal"
        },
        {
          "spell_id": "light_lcleric_magic_user_1st_level",
          "name": "Light"
        },
        {
          "spell_id": "magic_missile_lmagic_user_1st_level",
          "name": "Magic Missile"
        },
        {
          "spell_id": "protection_from_evil_lcleric_1st_level_magic_user_1st_level",
          "name": "Protection from Evil"
        },
        {
          "spell_id": "read_languages_lmagic_user_1st_level",
          "name": "Read languages"
        },
        {
          "spell_id": "read_magic_lmagic_user_1st_level",
          "name": "Read Magic"
        },
        {
          "spell_id": "shield_lmagic_user_1st_level",
          "name": "Shield"
        },
        {
          "spell_id": "sleep_lmagic_user_1st_level",
          "name": "Sleep"
        }
      ],
      "2": [
        {
          "spell_id": "continual_light_lmagic_user_2nd_level",
          "name": "Continual light"
        },
        {
          "spell_id": "darkness_15_foot_radius_lmagic_user_2nd_level",
          "name": "Darkness 15-foot Radius"
        },
        {
          "spell_id": "detect_evil_magic_user_lmagic_user_2nd_level",
          "name": "Detect Evil (Magic- user)"
        },
        {
          "spell_id": "detect_invisibility_lmagic_user_2nd_level",
          "name": "Detect invisibility"
        },
        {
          "spell_id": "esp_detect_thoughts_lmagic_user_2nd_level",
          "name": "ESP (Detect thoughts)"
        },
        {
          "spell_id": "invisibility_lmagic_user_2th_level",
          "name": "Invisibility"
        },
        {
          "spell_id": "knock_lmagic_user_2nd_level",
          "name": "Knock"
        },
        {
          "spell_id": "levitate_lmagic_user_2nd_level",
          "name": "Levitate"
        },
        {
          "spell_id": "locate_object_magic_user_lmagic_user_2nd_level",
          "name": "Locate Object Magic- User"
        },
        {
          "spell_id": "magic_mouth_lmagic_user_2nd_level",
          "name": "Magic Mouth"
        },
        {
          "spell_id": "mirror_image_lmagic_user_2nd_level",
          "name": "Mirror image"
        },
        {
          "spell_id": "phantasmal_force_lmagic_user_2nd_level",
          "name": "Phantasmal Force"
        },
        {
          "spell_id": "pyrotechnics_ldruid_3rd_level_magic_user_2nd_level",
          "name": "Pyrotechnics"
        },
        {
          "spell_id": "strength_lmagic_user_2nd_level",
          "name": "Strength"
        },
        {
          "spell_id": "web_lmagic_user_2nd_level",
          "name": "Web"
        },
        {
          "spell_id": "wizard_lock_lmagic_user_2nd_level",
          "name": "Wizard lock"
        }
      ],
      "3": [
        {
          "spell_id": "clairaudience_lmagic_user_3rd_level",
          "name": "Clairaudience"
        },
        {
          "spell_id": "clairvoyance_lmagic_user_3rd_level",
          "name": "Clairvoyance"
        },
        {
          "spell_id": "darkvision_lmagic_user_3rd_level",
          "name": "Darkvision"
        },
        {
          "spell_id": "dispel_magic_ldruid_4th_level_magic_user_3rd_level",
          "name": "Dispel Magic"
        },
        {
          "spell_id": "explosive_runes_lmagic_user_3rd_level",
          "name": "Explosive Runes"
        },
        {
          "spell_id": "fireball_lmagic_user_3rd_level",
          "name": "Fireball"
        },
        {
          "spell_id": "fly_lmagic_user_3rd_level",
          "name": "Fly"
        },
        {
          "spell_id": "haste_lmagic_user_3rd_level",
          "name": "Haste"
        },
        {
          "spell_id": "hold_person_magic_user_lmagic_user_3rd_level",
          "name": "Hold Person (Magic- user)"
        },
        {
          "spell_id": "invisibility_10_foot_radius_lmagic_user_3rd_level",
          "name": "Invisibility 10-Foot Radius"
        },
        {
          "spell_id": "lightning_bolt_lmagic_user_3rd_level",
          "name": "Lightning Bolt"
        },
        {
          "spell_id": "monster_summoning_i_lmagic_user_3rd_level",
          "name": "Monster Summoning i"
        },
        {